{
  "schemaVersion": "1.0",
  "type": "mcq",
  "id": "math-gaokao-30",
  "category": "— CHALLENGE HIGHER. GO FURTHER. —",
  "title": "MATH GAOKAO - 30",
  "description": "Authentic-style mathematics problems inspired by China’s Gaokao — build deeper understanding, sharper thinking, and real exam readiness.",
  "questionCount": 10,
  "questions": [
    {
      "id": "math-gaokao-30-q001",
      "category": "Algebra",
      "concept": "Algebraic Identities",
      "learningObjective": "Identify the correct expansion identity for the square of a binomial.",
      "difficulty": "Easy",
      "cognitiveLevel": "Comprehension",
      "question": "Which identity is correct?",
      "options": [
        {
          "label": "A",
          "text": "\\((a+b)^2=a^2+b^2\\)"
        },
        {
          "label": "B",
          "text": "\\((a+b)^2=a^2+2ab+b^2\\)"
        }
      ],
      "answer": "B",
      "explanation": "Expanding \\((a+b)^2\\) means multiplying \\((a+b)(a+b)\\). Using the distributive property,\n\\[\n(a+b)(a+b)=a^2+ab+ba+b^2=a^2+2ab+b^2.\n\\]\nTherefore, the correct identity is\n\\[\n(a+b)^2=a^2+2ab+b^2.\n\\]\nOption A is incorrect because it omits the middle term \\(2ab\\).",
      "hint": "Expand \\((a+b)(a+b)\\) and combine the two middle terms."
    },
    {
      "id": "math-gaokao-30-q002",
      "category": "Algebra",
      "concept": "Square of a Binomial",
      "learningObjective": "Expand \\((x+a)^2\\) using the square of a binomial identity.",
      "difficulty": "Easy",
      "cognitiveLevel": "Procedural",
      "question": "Expand \\((x+3)^2\\).",
      "options": [
        {
          "label": "A",
          "text": "\\(x^2+9\\)"
        },
        {
          "label": "B",
          "text": "\\(x^2+6x+9\\)"
        }
      ],
      "answer": "B",
      "explanation": "Use the identity \\((a+b)^2=a^2+2ab+b^2\\) with \\(a=x\\) and \\(b=3\\):\n\\[\n(x+3)^2=x^2+2\\cdot x\\cdot 3+3^2=x^2+6x+9.\n\\]\nTherefore, the correct expansion is \\(x^2+6x+9\\).",
      "hint": "Apply \\((a+b)^2=a^2+2ab+b^2\\)."
    },
    {
      "id": "math-gaokao-30-q003",
      "category": "Algebra",
      "concept": "Difference of Squares",
      "learningObjective": "Factor a difference of squares.",
      "difficulty": "Easy",
      "cognitiveLevel": "Procedural",
      "question": "Factor \\(x^2-25\\).",
      "options": [
        {
          "label": "A",
          "text": "\\((x-5)^2\\)"
        },
        {
          "label": "B",
          "text": "\\((x-5)(x+5)\\)"
        }
      ],
      "answer": "B",
      "explanation": "The expression \\(x^2-25\\) is a difference of squares:\n\\[\nx^2-25=x^2-5^2.\n\\]\nUsing the identity \\(a^2-b^2=(a-b)(a+b)\\), we get\n\\[\nx^2-25=(x-5)(x+5).\n\\]\nOption A expands to \\(x^2-10x+25\\), which is not equal to \\(x^2-25\\).",
      "hint": "Recognize \\(25\\) as \\(5^2\\) and use the difference of squares identity."
    },
    {
      "id": "math-gaokao-30-q004",
      "category": "Algebra",
      "concept": "Square of a Binomial",
      "learningObjective": "Expand \\((ax-b)^2\\) using the square of a binomial identity.",
      "difficulty": "Easy",
      "cognitiveLevel": "Procedural",
      "question": "Expand \\((2x-3)^2\\).",
      "options": [
        {
          "label": "A",
          "text": "\\(4x^2-12x+9\\)"
        },
        {
          "label": "B",
          "text": "\\(4x^2-9\\)"
        }
      ],
      "answer": "A",
      "explanation": "Use the identity \\((a-b)^2=a^2-2ab+b^2\\) with \\(a=2x\\) and \\(b=3\\):\n\\[\n(2x-3)^2=(2x)^2-2(2x)(3)+3^2=4x^2-12x+9.\n\\]\nTherefore, the correct expansion is \\(4x^2-12x+9\\). Option B omits the middle term.",
      "hint": "Apply \\((a-b)^2=a^2-2ab+b^2\\)."
    },
    {
      "id": "math-gaokao-30-q005",
      "category": "Algebra",
      "concept": "Algebraic Identities",
      "learningObjective": "Use the identity \\((a+b)^2=a^2+2ab+b^2\\) to find \\(a^2+b^2\\).",
      "difficulty": "Medium",
      "cognitiveLevel": "Application",
      "question": "If \\(a+b=7\\) and \\(ab=12\\), find \\(a^2+b^2\\).",
      "options": [
        {
          "label": "A",
          "text": "\\(25\\)"
        },
        {
          "label": "B",
          "text": "\\(37\\)"
        }
      ],
      "answer": "A",
      "explanation": "Using the identity\n\\[\n(a+b)^2=a^2+2ab+b^2,\n\\]\nwe can rearrange to get\n\\[\na^2+b^2=(a+b)^2-2ab.\n\\]\nSubstitute \\(a+b=7\\) and \\(ab=12\\):\n\\[\na^2+b^2=7^2-2\\cdot 12=49-24=25.\n\\]\nTherefore, \\(a^2+b^2=25\\).",
      "hint": "Use \\((a+b)^2=a^2+2ab+b^2\\) and solve for \\(a^2+b^2\\)."
    },
    {
      "id": "math-gaokao-30-q006",
      "category": "Algebra",
      "concept": "Algebraic Identities",
      "learningObjective": "Use the identity for \\(x^2+\\frac{1}{x^2}\\) from \\(x+\\frac{1}{x}\\).",
      "difficulty": "Medium",
      "cognitiveLevel": "Application",
      "question": "If \\(x+\\frac{1}{x}=3\\), find \\(x^2+\\frac{1}{x^2}\\).",
      "options": [
        {
          "label": "A",
          "text": "\\(11\\)"
        },
        {
          "label": "B",
          "text": "\\(7\\)"
        }
      ],
      "answer": "B",
      "explanation": "Square both sides of \\(x+\\frac{1}{x}=3\\):\n\\[\n\\left(x+\\frac{1}{x}\\right)^2=9.\n\\]\nUsing the identity \\((a+b)^2=a^2+2ab+b^2\\),\n\\[\nx^2+2\\cdot x\\cdot \\frac{1}{x}+\\frac{1}{x^2}=9.\n\\]\nSince \\(x\\cdot \\frac{1}{x}=1\\),\n\\[\nx^2+2+\\frac{1}{x^2}=9.\n\\]\nTherefore,\n\\[\nx^2+\\frac{1}{x^2}=9-2=7.\n\\]",
      "hint": "Square \\(x+\\frac{1}{x}\\) and use the fact that \\(x\\cdot \\frac{1}{x}=1\\)."
    },
    {
      "id": "math-gaokao-30-q007",
      "category": "Algebra",
      "concept": "Difference of Cubes",
      "learningObjective": "Factor a difference of cubes.",
      "difficulty": "Medium",
      "cognitiveLevel": "Reasoning",
      "question": "Factor \\(x^3-8\\).",
      "options": [
        {
          "label": "A",
          "text": "\\((x-2)(x^2+2x+4)\\)"
        },
        {
          "label": "B",
          "text": "\\((x-2)^3\\)"
        }
      ],
      "answer": "A",
      "explanation": "The expression \\(x^3-8\\) is a difference of cubes:\n\\[\nx^3-8=x^3-2^3.\n\\]\nUsing the identity \\(a^3-b^3=(a-b)(a^2+ab+b^2)\\), we get\n\\[\nx^3-8=(x-2)(x^2+2x+4).\n\\]\nOption B expands to \\(x^3-6x^2+12x-8\\), which is not equal to \\(x^3-8\\).",
      "hint": "Use the difference of cubes identity with \\(a=x\\) and \\(b=2\\)."
    },
    {
      "id": "math-gaokao-30-q008",
      "category": "Algebra",
      "concept": "Cube of a Binomial",
      "learningObjective": "Expand \\((x+a)^3\\) using the cube of a binomial identity.",
      "difficulty": "Medium",
      "cognitiveLevel": "Procedural",
      "question": "Expand \\((x+2)^3\\).",
      "options": [
        {
          "label": "A",
          "text": "\\(x^3+8\\)"
        },
        {
          "label": "B",
          "text": "\\(x^3+6x^2+12x+8\\)"
        }
      ],
      "answer": "B",
      "explanation": "Use the identity \\((a+b)^3=a^3+3a^2b+3ab^2+b^3\\) with \\(a=x\\) and \\(b=2\\):\n\\[\n(x+2)^3=x^3+3x^2(2)+3x(2^2)+2^3.\n\\]\nSimplify:\n\\[\n(x+2)^3=x^3+6x^2+12x+8.\n\\]\nTherefore, the correct expansion is \\(x^3+6x^2+12x+8\\).",
      "hint": "Apply \\((a+b)^3=a^3+3a^2b+3ab^2+b^3\\)."
    },
    {
      "id": "math-gaokao-30-q009",
      "category": "Algebra",
      "concept": "Algebraic Identities",
      "learningObjective": "Use the identity \\(a^3+b^3+c^3=3abc\\) when \\(a+b+c=0\\).",
      "difficulty": "Hard",
      "cognitiveLevel": "Problem-Solving",
      "question": "If \\(a+b+c=0\\) and \\(abc=5\\), find \\(a^3+b^3+c^3\\).",
      "options": [
        {
          "label": "A",
          "text": "\\(15\\)"
        },
        {
          "label": "B",
          "text": "\\(0\\)"
        }
      ],
      "answer": "A",
      "explanation": "When \\(a+b+c=0\\), the identity\n\\[\na^3+b^3+c^3=3abc\n\\]\nholds. Substituting \\(abc=5\\),\n\\[\na^3+b^3+c^3=3\\cdot 5=15.\n\\]\nTherefore, the value is \\(15\\). Option B would be correct only if \\(abc=0\\).",
      "hint": "Use the identity \\(a^3+b^3+c^3=3abc\\) under the condition \\(a+b+c=0\\)."
    },
    {
      "id": "math-gaokao-30-q010",
      "category": "Algebra",
      "concept": "Sum of Cubes",
      "learningObjective": "Use the identity \\(x^3+y^3=(x+y)^3-3xy(x+y)\\).",
      "difficulty": "Hard",
      "cognitiveLevel": "Analysis",
      "question": "If \\(x+y=5\\) and \\(xy=6\\), find \\(x^3+y^3\\).",
      "options": [
        {
          "label": "A",
          "text": "\\(35\\)"
        },
        {
          "label": "B",
          "text": "\\(65\\)"
        }
      ],
      "answer": "A",
      "explanation": "Use the identity\n\\[\nx^3+y^3=(x+y)^3-3xy(x+y).\n\\]\nSubstitute \\(x+y=5\\) and \\(xy=6\\):\n\\[\nx^3+y^3=5^3-3\\cdot 6\\cdot 5.\n\\]\nCompute:\n\\[\nx^3+y^3=125-90=35.\n\\]\nTherefore, \\(x^3+y^3=35\\).",
      "hint": "Use \\(x^3+y^3=(x+y)^3-3xy(x+y)\\) and substitute the given values."
    }
  ]
}