{
  "schemaVersion": "1.0",
  "type": "mcq",
  "id": "math-gaokao-119",
  "category": "— CHALLENGE HIGHER. GO FURTHER. —",
  "title": "MATH GAOKAO - 119",
  "description": "Authentic-style mathematics problems inspired by China’s Gaokao — build deeper understanding, sharper thinking, and real exam readiness.",
  "questionCount": 10,
  "questions": [
    {
      "id": "math-gaokao-119-q001",
      "category": "Algebra",
      "concept": "Geometric Sequences",
      "learningObjective": "Determine the common ratio of a geometric sequence from consecutive terms.",
      "difficulty": "Easy",
      "cognitiveLevel": "Procedural",
      "question": "Find the common ratio of the geometric sequence\n\\[\n3,\\ 6,\\ 12,\\ 24,\\ \\ldots\n\\]",
      "options": [
        {
          "label": "A",
          "text": "\\(3\\)"
        },
        {
          "label": "B",
          "text": "\\(2\\)"
        }
      ],
      "answer": "B",
      "explanation": "The common ratio is found by dividing any term by the previous term:\n\\[\n\\frac{6}{3}=2,\\qquad \\frac{12}{6}=2,\\qquad \\frac{24}{12}=2.\n\\]\nTherefore, the common ratio is\n\\[\n2.\n\\]",
      "hint": "Divide any term by the term immediately before it."
    },
    {
      "id": "math-gaokao-119-q002",
      "category": "Algebra",
      "concept": "Geometric Sequences",
      "learningObjective": "Find the next term of a geometric sequence.",
      "difficulty": "Easy",
      "cognitiveLevel": "Procedural",
      "question": "Find the next term of the geometric sequence\n\\[\n2,\\ 6,\\ 18,\\ \\ldots\n\\]",
      "options": [
        {
          "label": "A",
          "text": "\\(36\\)"
        },
        {
          "label": "B",
          "text": "\\(54\\)"
        }
      ],
      "answer": "B",
      "explanation": "The common ratio is\n\\[\n\\frac{6}{2}=3.\n\\]\nTherefore, the next term is\n\\[\n18\\cdot 3=54.\n\\]",
      "hint": "Find the common ratio first, then multiply it by the last given term."
    },
    {
      "id": "math-gaokao-119-q003",
      "category": "Algebra",
      "concept": "Geometric Sequences",
      "learningObjective": "Find a specified term of a geometric sequence given its first term and common ratio.",
      "difficulty": "Easy",
      "cognitiveLevel": "Procedural",
      "question": "A geometric sequence has first term \\(a_1=5\\) and common ratio \\(r=2\\). Find \\(a_4\\).",
      "options": [
        {
          "label": "A",
          "text": "\\(40\\)"
        },
        {
          "label": "B",
          "text": "\\(80\\)"
        }
      ],
      "answer": "A",
      "explanation": "The general term of a geometric sequence is\n\\[\na_n=a_1r^{n-1}.\n\\]\nSubstitute \\(a_1=5\\), \\(r=2\\), and \\(n=4\\):\n\\[\na_4=5\\cdot 2^{4-1}=5\\cdot 2^3=5\\cdot 8=40.\n\\]\nTherefore,\n\\[\na_4=40.\n\\]",
      "hint": "Use the formula \\(a_n=a_1r^{n-1}\\)."
    },
    {
      "id": "math-gaokao-119-q004",
      "category": "Algebra",
      "concept": "Geometric Sequences",
      "learningObjective": "Find the common ratio given the first term and another term of a geometric sequence.",
      "difficulty": "Medium",
      "cognitiveLevel": "Procedural",
      "question": "A geometric sequence has \\(a_1=2\\) and \\(a_4=54\\). Find the common ratio \\(r\\).",
      "options": [
        {
          "label": "A",
          "text": "\\(3\\)"
        },
        {
          "label": "B",
          "text": "\\(9\\)"
        }
      ],
      "answer": "A",
      "explanation": "Using the general term,\n\\[\na_4=a_1r^{3}.\n\\]\nSubstitute \\(a_1=2\\) and \\(a_4=54\\):\n\\[\n54=2r^3.\n\\]\nThen\n\\[\nr^3=27,\n\\]\nso\n\\[\nr=3.\n\\]\nTherefore, the common ratio is \\(3\\).",
      "hint": "Use \\(a_4=a_1r^3\\) and solve for \\(r\\)."
    },
    {
      "id": "math-gaokao-119-q005",
      "category": "Algebra",
      "concept": "Geometric Sequences",
      "learningObjective": "Determine the general term of a geometric sequence from its first few terms.",
      "difficulty": "Medium",
      "cognitiveLevel": "Application",
      "question": "Find the general term \\(a_n\\) of the geometric sequence\n\\[\n4,\\ 12,\\ 36,\\ \\ldots\n\\]",
      "options": [
        {
          "label": "A",
          "text": "\\(a_n=4\\cdot 3^{n-1}\\)"
        },
        {
          "label": "B",
          "text": "\\(a_n=3\\cdot 4^{n-1}\\)"
        }
      ],
      "answer": "A",
      "explanation": "The first term is \\(a_1=4\\), and the common ratio is\n\\[\nr=\\frac{12}{4}=3.\n\\]\nFor a geometric sequence,\n\\[\na_n=a_1r^{n-1}.\n\\]\nThus\n\\[\na_n=4\\cdot 3^{n-1}.\n\\]",
      "hint": "Find the first term and the common ratio, then use \\(a_n=a_1r^{n-1}\\)."
    },
    {
      "id": "math-gaokao-119-q006",
      "category": "Algebra",
      "concept": "Sum of a Geometric Sequence",
      "learningObjective": "Compute the sum of the first \\(n\\) terms of a geometric sequence.",
      "difficulty": "Medium",
      "cognitiveLevel": "Application",
      "question": "Find the sum of the first \\(5\\) terms of the geometric sequence\n\\[\n1,\\ 2,\\ 4,\\ 8,\\ \\ldots\n\\]",
      "options": [
        {
          "label": "A",
          "text": "\\(30\\)"
        },
        {
          "label": "B",
          "text": "\\(31\\)"
        }
      ],
      "answer": "B",
      "explanation": "The first term is \\(a_1=1\\), and the common ratio is\n\\[\nr=\\frac{2}{1}=2.\n\\]\nThe sum of the first \\(n\\) terms is\n\\[\nS_n=\\frac{a_1(r^n-1)}{r-1}.\n\\]\nFor \\(n=5\\),\n\\[\nS_5=\\frac{1(2^5-1)}{2-1}=\\frac{32-1}{1}=31.\n\\]\nTherefore, the sum is \\(31\\).",
      "hint": "Use the finite geometric sum formula \\(S_n=\\frac{a_1(r^n-1)}{r-1}\\)."
    },
    {
      "id": "math-gaokao-119-q007",
      "category": "Algebra",
      "concept": "Geometric Sequences",
      "learningObjective": "Find a later term of a geometric sequence given its first term and common ratio.",
      "difficulty": "Medium",
      "cognitiveLevel": "Procedural",
      "question": "A geometric sequence has first term \\(a_1=3\\) and common ratio \\(r=2\\). Find \\(a_6\\).",
      "options": [
        {
          "label": "A",
          "text": "\\(96\\)"
        },
        {
          "label": "B",
          "text": "\\(192\\)"
        }
      ],
      "answer": "A",
      "explanation": "Using the general term,\n\\[\na_n=a_1r^{n-1}.\n\\]\nSubstitute \\(a_1=3\\), \\(r=2\\), and \\(n=6\\):\n\\[\na_6=3\\cdot 2^{6-1}=3\\cdot 2^5=3\\cdot 32=96.\n\\]\nTherefore,\n\\[\na_6=96.\n\\]",
      "hint": "Substitute \\(n=6\\), \\(a_1=3\\), and \\(r=2\\) into \\(a_n=a_1r^{n-1}\\)."
    },
    {
      "id": "math-gaokao-119-q008",
      "category": "Algebra",
      "concept": "Sum of a Geometric Sequence",
      "learningObjective": "Compute the sum of the first \\(n\\) terms of a geometric sequence with a given common ratio.",
      "difficulty": "Medium",
      "cognitiveLevel": "Application",
      "question": "Find the sum of the first \\(4\\) terms of the geometric sequence with first term \\(a_1=2\\) and common ratio \\(r=3\\).",
      "options": [
        {
          "label": "A",
          "text": "\\(78\\)"
        },
        {
          "label": "B",
          "text": "\\(80\\)"
        }
      ],
      "answer": "B",
      "explanation": "Using the finite geometric sum formula,\n\\[\nS_n=\\frac{a_1(r^n-1)}{r-1}.\n\\]\nSubstitute \\(a_1=2\\), \\(r=3\\), and \\(n=4\\):\n\\[\nS_4=\\frac{2(3^4-1)}{3-1}.\n\\]\nThus\n\\[\nS_4=\\frac{2(81-1)}{2}=81-1=80.\n\\]\nTherefore, the sum is \\(80\\).",
      "hint": "Use \\(S_n=\\frac{a_1(r^n-1)}{r-1}\\)."
    },
    {
      "id": "math-gaokao-119-q009",
      "category": "Algebra",
      "concept": "Geometric Sequences",
      "learningObjective": "Find the common ratio given two non-consecutive terms of a geometric sequence.",
      "difficulty": "Hard",
      "cognitiveLevel": "Reasoning",
      "question": "In a geometric sequence, \\(a_2=6\\) and \\(a_5=48\\). Find the common ratio \\(r\\).",
      "options": [
        {
          "label": "A",
          "text": "\\(2\\)"
        },
        {
          "label": "B",
          "text": "\\(4\\)"
        }
      ],
      "answer": "A",
      "explanation": "For a geometric sequence,\n\\[\na_5=a_2r^{3}.\n\\]\nSubstitute \\(a_2=6\\) and \\(a_5=48\\):\n\\[\n48=6r^3.\n\\]\nThen\n\\[\nr^3=8,\n\\]\nso\n\\[\nr=2.\n\\]\nTherefore, the common ratio is \\(2\\).",
      "hint": "The difference between the indices \\(5\\) and \\(2\\) is \\(3\\), so use \\(a_5=a_2r^3\\)."
    },
    {
      "id": "math-gaokao-119-q010",
      "category": "Algebra",
      "concept": "Infinite Geometric Series",
      "learningObjective": "Compute the sum of an infinite geometric series with common ratio between \\(-1\\) and \\(1\\).",
      "difficulty": "Hard",
      "cognitiveLevel": "Problem-Solving",
      "question": "Find the sum of the infinite geometric series\n\\[\n8+4+2+1+\\cdots\n\\]",
      "options": [
        {
          "label": "A",
          "text": "\\(14\\)"
        },
        {
          "label": "B",
          "text": "\\(16\\)"
        }
      ],
      "answer": "B",
      "explanation": "The first term is \\(a_1=8\\), and the common ratio is\n\\[\nr=\\frac{4}{8}=\\frac{1}{2}.\n\\]\nSince \\(|r|<1\\), the infinite geometric series converges, and its sum is\n\\[\nS=\\frac{a_1}{1-r}.\n\\]\nThus\n\\[\nS=\\frac{8}{1-\\frac{1}{2}}=\\frac{8}{\\frac{1}{2}}=16.\n\\]\nTherefore, the sum is \\(16\\).",
      "hint": "Use \\(S=\\frac{a_1}{1-r}\\) when \\(|r|<1\\)."
    }
  ]
}