{
  "schemaVersion": "1.0",
  "type": "mcq",
  "id": "dynanca-93",
  "category": "Comprehensive Mathematics",
  "title": "93. Quantitative Relationships & Measurement: Simplifying Ratios",
  "description": "A comprehensive mathematics curriculum progressing from foundational numeracy and core mathematical concepts to algebra, geometry, calculus, linear algebra, probability, statistics, discrete mathematics, optimization, mathematical foundations of AI, advanced pure mathematics, and emerging research methods.",
  "questionCount": 10,
  "questions": [
    {
      "id": "dynanca-93-q001",
      "category": "Quantitative Relationships & Measurement",
      "concept": "Simplifying an Integer Ratio",
      "learningObjective": "Reduce a two-term ratio to coprime integer terms.",
      "difficulty": "Easy",
      "cognitiveLevel": "Procedural",
      "question": "Simplify \\(14:21\\).",
      "options": [
        {
          "label": "A",
          "text": "\\(2:7\\)"
        },
        {
          "label": "B",
          "text": "\\(2:3\\)"
        }
      ],
      "answer": "B",
      "explanation": "The greatest common divisor is \\(7\\). Dividing both terms by \\(7\\) gives \\(2:3\\). The alternative divides the terms by different factors.",
      "hint": "Use the same common divisor for both terms."
    },
    {
      "id": "dynanca-93-q002",
      "category": "Quantitative Relationships & Measurement",
      "concept": "Reducing a Ratio of Multiples of Five",
      "learningObjective": "Reduce a two-term integer ratio using the greatest common divisor.",
      "difficulty": "Easy",
      "cognitiveLevel": "Procedural",
      "question": "Simplify \\(25:10\\).",
      "options": [
        {
          "label": "A",
          "text": "\\(5:2\\)"
        },
        {
          "label": "B",
          "text": "\\(5:1\\)"
        }
      ],
      "answer": "A",
      "explanation": "Divide both terms by their greatest common divisor \\(5\\) to get \\(5:2\\). The alternative divides the second term by \\(10\\) instead of \\(5\\).",
      "hint": "Find the greatest common divisor of the two terms."
    },
    {
      "id": "dynanca-93-q003",
      "category": "Quantitative Relationships & Measurement",
      "concept": "Testing Lowest Terms",
      "learningObjective": "Recognize whether ratio terms have a common factor.",
      "difficulty": "Easy",
      "cognitiveLevel": "Comprehension",
      "question": "Which ratio is already in simplest form?",
      "options": [
        {
          "label": "A",
          "text": "\\(8:15\\)"
        },
        {
          "label": "B",
          "text": "\\(9:15\\)"
        }
      ],
      "answer": "A",
      "explanation": "The terms \\(8\\) and \\(15\\) have greatest common divisor \\(1\\), so they cannot be reduced. The terms \\(9\\) and \\(15\\) share factor \\(3\\), giving \\(3:5\\).",
      "hint": "Check whether the two terms share a positive divisor greater than one."
    },
    {
      "id": "dynanca-93-q004",
      "category": "Quantitative Relationships & Measurement",
      "concept": "Simplifying a Three-Term Ratio",
      "learningObjective": "Reduce every term of a three-part ratio by the same common divisor.",
      "difficulty": "Medium",
      "cognitiveLevel": "Procedural",
      "question": "Simplify \\(18:30:42\\).",
      "options": [
        {
          "label": "A",
          "text": "\\(3:5:6\\)"
        },
        {
          "label": "B",
          "text": "\\(3:5:7\\)"
        }
      ],
      "answer": "B",
      "explanation": "The greatest common divisor of all three terms is \\(6\\). Dividing each term by \\(6\\) gives \\(3:5:7\\). The alternative changes the last proportion.",
      "hint": "Use a divisor common to all three terms."
    },
    {
      "id": "dynanca-93-q005",
      "category": "Quantitative Relationships & Measurement",
      "concept": "Simplifying a Decimal Ratio",
      "learningObjective": "Convert decimal ratio terms to integers before reducing.",
      "difficulty": "Medium",
      "cognitiveLevel": "Procedural",
      "question": "Simplify \\(0.45:0.75\\) to coprime positive integer terms.",
      "options": [
        {
          "label": "A",
          "text": "\\(9:5\\)"
        },
        {
          "label": "B",
          "text": "\\(3:5\\)"
        }
      ],
      "answer": "B",
      "explanation": "Multiplying both terms by \\(100\\) gives \\(45:75\\). Dividing both by \\(15\\) gives \\(3:5\\). The alternative does not preserve the quotient of the original terms.",
      "hint": "Clear decimal places by scaling every term by the same power of ten."
    },
    {
      "id": "dynanca-93-q006",
      "category": "Quantitative Relationships & Measurement",
      "concept": "Simplifying a Fractional Ratio",
      "learningObjective": "Clear fractional denominators with a common multiplier.",
      "difficulty": "Medium",
      "cognitiveLevel": "Procedural",
      "question": "Simplify \\(\\frac{2}{3}:\\frac{5}{4}\\) to coprime positive integer terms.",
      "options": [
        {
          "label": "A",
          "text": "\\(8:15\\)"
        },
        {
          "label": "B",
          "text": "\\(10:12\\)"
        }
      ],
      "answer": "A",
      "explanation": "Multiply both terms by the common denominator \\(12\\): \\(\\left(\\frac{2}{3}\\right)\\times12=8\\) and \\(\\left(\\frac{5}{4}\\right)\\times12=15\\). Their greatest common divisor is one. The alternative multiplies numerators and denominators in the wrong positions.",
      "hint": "Multiply every term by a common multiple of the denominators."
    },
    {
      "id": "dynanca-93-q007",
      "category": "Quantitative Relationships & Measurement",
      "concept": "Simplifying a Ratio with Mixed Length Units",
      "learningObjective": "Convert quantities to a common unit before reducing their ratio.",
      "difficulty": "Medium",
      "cognitiveLevel": "Application",
      "question": "Simplify the ratio \\(1.2\\text{ m}:45\\text{ cm}\\).",
      "options": [
        {
          "label": "A",
          "text": "\\(8:3\\)"
        },
        {
          "label": "B",
          "text": "\\(2:75\\)"
        }
      ],
      "answer": "A",
      "explanation": "Convert \\(1.2\\text{ m}=120\\text{ cm}\\). Then \\(120:45\\) divides by \\(15\\) to give \\(8:3\\). The alternative reduces \\(1.2:45\\) without converting units.",
      "hint": "Express both lengths in the same unit before simplifying."
    },
    {
      "id": "dynanca-93-q008",
      "category": "Quantitative Relationships & Measurement",
      "concept": "Simplifying a Three-Term Fractional Ratio",
      "learningObjective": "Use a common denominator and then reduce all ratio terms.",
      "difficulty": "Medium",
      "cognitiveLevel": "Procedural",
      "question": "Simplify \\(\\frac{1}{2}:\\frac{3}{4}:\\frac{5}{8}\\) to coprime positive integer terms.",
      "options": [
        {
          "label": "A",
          "text": "\\(1:3:5\\)"
        },
        {
          "label": "B",
          "text": "\\(4:6:5\\)"
        }
      ],
      "answer": "B",
      "explanation": "Multiply every term by \\(8\\) to obtain \\(4:6:5\\). The three integers have greatest common divisor one. The alternative drops denominators without applying a common multiplier.",
      "hint": "Clear all denominators using one common multiplier."
    },
    {
      "id": "dynanca-93-q009",
      "category": "Quantitative Relationships & Measurement",
      "concept": "Checking a Proposed Ratio Simplification",
      "learningObjective": "Detect unequal scaling in a proposed simplification.",
      "difficulty": "Medium",
      "cognitiveLevel": "Reasoning",
      "question": "A student simplifies \\(24:36\\) to \\(4:9\\). Which statement is correct?",
      "options": [
        {
          "label": "A",
          "text": "The result is correct because each term was divided by one of its factors."
        },
        {
          "label": "B",
          "text": "The result is incorrect because the terms were divided by different factors; the simplest ratio is \\(2:3\\)."
        }
      ],
      "answer": "B",
      "explanation": "The first term was divided by \\(6\\), but the second by \\(4\\), which changes the ratio. Divide both original terms by \\(12\\) to get \\(2:3\\). Being a factor of a term is insufficient; both terms need the same scale factor.",
      "hint": "Compare the scale factor applied to each term."
    },
    {
      "id": "dynanca-93-q010",
      "category": "Quantitative Relationships & Measurement",
      "concept": "Simplifying Three Decimal Quantities",
      "learningObjective": "Combine decimal scaling with a greatest common divisor.",
      "difficulty": "Medium",
      "cognitiveLevel": "Application",
      "question": "A mixture uses three ingredients in amounts \\(0.36\\), \\(0.54\\), and \\(0.90\\) litres. What is their ratio in coprime positive integer terms, in the given order?",
      "options": [
        {
          "label": "A",
          "text": "\\(2:3:5\\)"
        },
        {
          "label": "B",
          "text": "\\(2:3:9\\)"
        }
      ],
      "answer": "A",
      "explanation": "Multiply by \\(100\\) to obtain \\(36:54:90\\). The greatest common divisor is \\(18\\), and division by \\(18\\) gives \\(2:3:5\\). The alternative scales the last amount inconsistently.",
      "hint": "Clear the decimals first, then find a divisor common to all three integer terms."
    }
  ]
}