{
  "schemaVersion": "1.0",
  "type": "mcq",
  "id": "math-gaokao-180",
  "category": "— CHALLENGE HIGHER. GO FURTHER. —",
  "title": "MATH GAOKAO - 180",
  "description": "Authentic-style mathematics problems inspired by China’s Gaokao — build deeper understanding, sharper thinking, and real exam readiness.",
  "questionCount": 10,
  "questions": [
    {
      "id": "math-gaokao-180-q001",
      "category": "Vectors",
      "concept": "Perpendicular Vectors Condition",
      "learningObjective": "Identify the dot-product condition for two nonzero vectors to be perpendicular.",
      "difficulty": "Easy",
      "cognitiveLevel": "Comprehension",
      "question": "For two nonzero vectors \\(\\vec{a}\\) and \\(\\vec{b}\\), which condition means that \\(\\vec{a}\\) and \\(\\vec{b}\\) are perpendicular?",
      "options": [
        {
          "label": "A",
          "text": "\\(\\vec{a}\\cdot\\vec{b}=0\\)"
        },
        {
          "label": "B",
          "text": "\\(\\vec{a}\\cdot\\vec{b}=|\\vec{a}||\\vec{b}|\\)"
        }
      ],
      "answer": "A",
      "explanation": "Two nonzero vectors are perpendicular exactly when the angle between them is \\(90^\\circ\\). Since\n\\[\n\\vec{a}\\cdot\\vec{b}=|\\vec{a}||\\vec{b}|\\cos\\theta,\n\\]\nand \\(\\cos 90^\\circ=0\\), perpendicular vectors satisfy\n\\[\n\\vec{a}\\cdot\\vec{b}=0.\n\\]\nThe condition \\(\\vec{a}\\cdot\\vec{b}=|\\vec{a}||\\vec{b}|\\) would mean \\(\\cos\\theta=1\\), so the vectors point in the same direction.",
      "hint": "Recall the dot-product formula involving the cosine of the angle between the vectors."
    },
    {
      "id": "math-gaokao-180-q002",
      "category": "Vectors",
      "concept": "Testing Perpendicularity Using Components",
      "learningObjective": "Determine whether two component vectors are perpendicular by evaluating their dot product.",
      "difficulty": "Easy",
      "cognitiveLevel": "Procedural",
      "question": "Are the vectors \\((2,-3)\\) and \\((3,2)\\) perpendicular?",
      "options": [
        {
          "label": "A",
          "text": "Yes"
        },
        {
          "label": "B",
          "text": "No"
        }
      ],
      "answer": "A",
      "explanation": "Compute the dot product:\n\\[\n(2,-3)\\cdot(3,2)=2(3)+(-3)(2)=6-6=0.\n\\]\nSince the dot product is zero, the vectors are perpendicular.",
      "hint": "Compute the sum of the products of corresponding components."
    },
    {
      "id": "math-gaokao-180-q003",
      "category": "Vectors",
      "concept": "Finding an Unknown Component for Perpendicular Vectors",
      "learningObjective": "Determine an unknown component so that two given vectors are perpendicular.",
      "difficulty": "Easy",
      "cognitiveLevel": "Procedural",
      "question": "If \\((k,4)\\) and \\((2,-3)\\) are perpendicular, find \\(k\\).",
      "options": [
        {
          "label": "A",
          "text": "\\(6\\)"
        },
        {
          "label": "B",
          "text": "\\(-6\\)"
        }
      ],
      "answer": "A",
      "explanation": "Perpendicular vectors satisfy\n\\[\n(k,4)\\cdot(2,-3)=0.\n\\]\nThus\n\\[\n2k+4(-3)=0,\n\\]\nso\n\\[\n2k-12=0 \\quad\\Rightarrow\\quad k=6.\n\\]",
      "hint": "Set the dot product equal to zero and solve for \\(k\\)."
    },
    {
      "id": "math-gaokao-180-q004",
      "category": "Vectors",
      "concept": "Magnitude of a Sum of Perpendicular Vectors",
      "learningObjective": "Find the magnitude of the sum of two perpendicular vectors given their magnitudes.",
      "difficulty": "Medium",
      "cognitiveLevel": "Application",
      "question": "If \\(|\\vec{a}|=3\\), \\(|\\vec{b}|=4\\), and \\(\\vec{a}\\perp\\vec{b}\\), find \\(|\\vec{a}+\\vec{b}|\\).",
      "options": [
        {
          "label": "A",
          "text": "\\(5\\)"
        },
        {
          "label": "B",
          "text": "\\(7\\)"
        }
      ],
      "answer": "A",
      "explanation": "Since \\(\\vec{a}\\perp\\vec{b}\\), we have\n\\[\n|\\vec{a}+\\vec{b}|^2=|\\vec{a}|^2+|\\vec{b}|^2.\n\\]\nThus\n\\[\n|\\vec{a}+\\vec{b}|^2=3^2+4^2=9+16=25.\n\\]\nTherefore,\n\\[\n|\\vec{a}+\\vec{b}|=5.\n\\]",
      "hint": "Use the Pythagorean relation for perpendicular vectors."
    },
    {
      "id": "math-gaokao-180-q005",
      "category": "Vectors",
      "concept": "Finding a Component for Perpendicular Vectors",
      "learningObjective": "Determine an unknown component so that two component vectors are perpendicular.",
      "difficulty": "Easy",
      "cognitiveLevel": "Procedural",
      "question": "If \\((1,2)\\) and \\((2,m)\\) are perpendicular, find \\(m\\).",
      "options": [
        {
          "label": "A",
          "text": "\\(-1\\)"
        },
        {
          "label": "B",
          "text": "\\(1\\)"
        }
      ],
      "answer": "A",
      "explanation": "Perpendicular vectors satisfy\n\\[\n(1,2)\\cdot(2,m)=0.\n\\]\nThus\n\\[\n1(2)+2m=0,\n\\]\nso\n\\[\n2+2m=0 \\quad\\Rightarrow\\quad m=-1.\n\\]",
      "hint": "Set the dot product equal to zero and solve for \\(m\\)."
    },
    {
      "id": "math-gaokao-180-q006",
      "category": "Vectors",
      "concept": "Solving for a Component in a Perpendicular Condition",
      "learningObjective": "Determine an unknown component from a perpendicularity equation.",
      "difficulty": "Medium",
      "cognitiveLevel": "Application",
      "question": "If \\((x,2)\\) and \\((3,-4)\\) are perpendicular, find \\(x\\).",
      "options": [
        {
          "label": "A",
          "text": "\\(2\\)"
        },
        {
          "label": "B",
          "text": "\\(\\frac{8}{3}\\)"
        }
      ],
      "answer": "B",
      "explanation": "Perpendicular vectors satisfy\n\\[\n(x,2)\\cdot(3,-4)=0.\n\\]\nThus\n\\[\n3x+2(-4)=0,\n\\]\nso\n\\[\n3x-8=0 \\quad\\Rightarrow\\quad x=\\frac{8}{3}.\n\\]",
      "hint": "Compute the dot product, set it equal to zero, and solve for \\(x\\)."
    },
    {
      "id": "math-gaokao-180-q007",
      "category": "Vectors",
      "concept": "Perpendicular Vectors with a Parameter",
      "learningObjective": "Determine a parameter so that two vectors are perpendicular.",
      "difficulty": "Medium",
      "cognitiveLevel": "Application",
      "question": "If \\((2,k)\\) and \\((-1,3)\\) are perpendicular, find \\(k\\).",
      "options": [
        {
          "label": "A",
          "text": "\\(\\frac{3}{2}\\)"
        },
        {
          "label": "B",
          "text": "\\(\\frac{2}{3}\\)"
        }
      ],
      "answer": "B",
      "explanation": "Perpendicular vectors satisfy\n\\[\n(2,k)\\cdot(-1,3)=0.\n\\]\nThus\n\\[\n2(-1)+k(3)=0,\n\\]\nso\n\\[\n-2+3k=0 \\quad\\Rightarrow\\quad k=\\frac{2}{3}.\n\\]",
      "hint": "Set the dot product equal to zero and solve for \\(k\\)."
    },
    {
      "id": "math-gaokao-180-q008",
      "category": "Vectors",
      "concept": "Magnitude of a Sum of Perpendicular Vectors",
      "learningObjective": "Find the magnitude of the sum of two perpendicular vectors from their magnitudes.",
      "difficulty": "Medium",
      "cognitiveLevel": "Application",
      "question": "If \\(|\\vec{a}|=2\\), \\(|\\vec{b}|=5\\), and \\(\\vec{a}\\perp\\vec{b}\\), find \\(|\\vec{a}+\\vec{b}|\\).",
      "options": [
        {
          "label": "A",
          "text": "\\(7\\)"
        },
        {
          "label": "B",
          "text": "\\(\\sqrt{29}\\)"
        }
      ],
      "answer": "B",
      "explanation": "Since \\(\\vec{a}\\perp\\vec{b}\\),\n\\[\n|\\vec{a}+\\vec{b}|^2=|\\vec{a}|^2+|\\vec{b}|^2.\n\\]\nThus\n\\[\n|\\vec{a}+\\vec{b}|^2=2^2+5^2=4+25=29.\n\\]\nTherefore,\n\\[\n|\\vec{a}+\\vec{b}|=\\sqrt{29}.\n\\]",
      "hint": "Use the Pythagorean relation for perpendicular vectors."
    },
    {
      "id": "math-gaokao-180-q009",
      "category": "Vectors",
      "concept": "Finding a Vector Perpendicular to a Given Vector",
      "learningObjective": "Identify a vector perpendicular to a given component vector.",
      "difficulty": "Easy",
      "cognitiveLevel": "Comprehension",
      "question": "Which vector is perpendicular to \\((3,4)\\)?",
      "options": [
        {
          "label": "A",
          "text": "\\((4,3)\\)"
        },
        {
          "label": "B",
          "text": "\\((-4,3)\\)"
        }
      ],
      "answer": "B",
      "explanation": "Check the dot product with \\((3,4)\\):\n\\[\n(3,4)\\cdot(-4,3)=3(-4)+4(3)=-12+12=0.\n\\]\nThus \\((-4,3)\\) is perpendicular to \\((3,4)\\). For \\((4,3)\\),\n\\[\n(3,4)\\cdot(4,3)=12+12=24\\neq 0,\n\\]\nso it is not perpendicular.",
      "hint": "Test each option by computing its dot product with \\((3,4)\\)."
    },
    {
      "id": "math-gaokao-180-q010",
      "category": "Vectors",
      "concept": "Magnitude of a Difference of Perpendicular Unit Vectors",
      "learningObjective": "Find the magnitude of the difference of two perpendicular unit vectors.",
      "difficulty": "Medium",
      "cognitiveLevel": "Application",
      "question": "If \\(|\\vec{a}|=|\\vec{b}|=1\\) and \\(\\vec{a}\\perp\\vec{b}\\), find \\(|\\vec{a}-\\vec{b}|\\).",
      "options": [
        {
          "label": "A",
          "text": "\\(0\\)"
        },
        {
          "label": "B",
          "text": "\\(\\sqrt{2}\\)"
        }
      ],
      "answer": "B",
      "explanation": "Since \\(\\vec{a}\\perp\\vec{b}\\), we have\n\\[\n|\\vec{a}-\\vec{b}|^2=|\\vec{a}|^2+|\\vec{b}|^2.\n\\]\nThus\n\\[\n|\\vec{a}-\\vec{b}|^2=1^2+1^2=2.\n\\]\nTherefore,\n\\[\n|\\vec{a}-\\vec{b}|=\\sqrt{2}.\n\\]",
      "hint": "Use the Pythagorean relation for perpendicular vectors."
    }
  ]
}