{
  "schemaVersion": "1.0",
  "type": "mcq",
  "id": "math-gaokao-32",
  "category": "— CHALLENGE HIGHER. GO FURTHER. —",
  "title": "MATH GAOKAO - 32",
  "description": "Authentic-style mathematics problems inspired by China’s Gaokao — build deeper understanding, sharper thinking, and real exam readiness.",
  "questionCount": 10,
  "questions": [
    {
      "id": "math-gaokao-32-q001",
      "category": "Algebra",
      "concept": "Square of a Binomial",
      "learningObjective": "Expand the square of a binomial using the perfect-square identity.",
      "difficulty": "Easy",
      "cognitiveLevel": "Procedural",
      "question": "Expand \\((x+4)^2\\).",
      "options": [
        {
          "label": "A",
          "text": "\\(x^2+8x+16\\)"
        },
        {
          "label": "B",
          "text": "\\(x^2+16\\)"
        }
      ],
      "answer": "A",
      "explanation": "Use the identity\n\\[\n(a+b)^2=a^2+2ab+b^2.\n\\]\nHere \\(a=x\\) and \\(b=4\\), so\n\\[\n(x+4)^2=x^2+2\\cdot x\\cdot 4+4^2=x^2+8x+16.\n\\]\nOption B omits the middle term \\(8x\\).",
      "hint": "Apply \\((a+b)^2=a^2+2ab+b^2\\)."
    },
    {
      "id": "math-gaokao-32-q002",
      "category": "Algebra",
      "concept": "Square of a Binomial",
      "learningObjective": "Expand the square of a binomial with subtraction.",
      "difficulty": "Easy",
      "cognitiveLevel": "Procedural",
      "question": "Expand \\((x-5)^2\\).",
      "options": [
        {
          "label": "A",
          "text": "\\(x^2-25\\)"
        },
        {
          "label": "B",
          "text": "\\(x^2-10x+25\\)"
        }
      ],
      "answer": "B",
      "explanation": "Use the identity\n\\[\n(a-b)^2=a^2-2ab+b^2.\n\\]\nWith \\(a=x\\) and \\(b=5\\),\n\\[\n(x-5)^2=x^2-2\\cdot x\\cdot 5+5^2=x^2-10x+25.\n\\]\nTherefore, the correct expansion is \\(x^2-10x+25\\).",
      "hint": "Apply \\((a-b)^2=a^2-2ab+b^2\\)."
    },
    {
      "id": "math-gaokao-32-q003",
      "category": "Algebra",
      "concept": "Factoring Perfect-Square Trinomials",
      "learningObjective": "Factor a perfect-square trinomial.",
      "difficulty": "Easy",
      "cognitiveLevel": "Procedural",
      "question": "Factor \\(x^2+6x+9\\).",
      "options": [
        {
          "label": "A",
          "text": "\\((x+3)^2\\)"
        },
        {
          "label": "B",
          "text": "\\((x-3)^2\\)"
        }
      ],
      "answer": "A",
      "explanation": "The expression is a perfect-square trinomial because\n\\[\nx^2+6x+9=x^2+2\\cdot x\\cdot 3+3^2.\n\\]\nUsing \\((a+b)^2=a^2+2ab+b^2\\), we get\n\\[\nx^2+6x+9=(x+3)^2.\n\\]\nOption B expands to \\(x^2-6x+9\\), so it is incorrect.",
      "hint": "Check whether the first and last terms are squares and whether the middle term equals \\(2ab\\)."
    },
    {
      "id": "math-gaokao-32-q004",
      "category": "Algebra",
      "concept": "Factoring Perfect-Square Trinomials",
      "learningObjective": "Factor a perfect-square trinomial whose leading coefficient is not \\(1\\).",
      "difficulty": "Medium",
      "cognitiveLevel": "Procedural",
      "question": "Factor \\(4x^2-12x+9\\).",
      "options": [
        {
          "label": "A",
          "text": "\\((2x+3)^2\\)"
        },
        {
          "label": "B",
          "text": "\\((2x-3)^2\\)"
        }
      ],
      "answer": "B",
      "explanation": "Write the trinomial as\n\\[\n4x^2-12x+9=(2x)^2-2\\cdot (2x)\\cdot 3+3^2.\n\\]\nUsing \\((a-b)^2=a^2-2ab+b^2\\), we obtain\n\\[\n4x^2-12x+9=(2x-3)^2.\n\\]\nOption A expands to \\(4x^2+12x+9\\), so it is incorrect.",
      "hint": "Recognize \\(4x^2\\) as \\((2x)^2\\) and \\(9\\) as \\(3^2\\)."
    },
    {
      "id": "math-gaokao-32-q005",
      "category": "Algebra",
      "concept": "Perfect-Square Identities",
      "learningObjective": "Use the identity \\((a+b)^2=a^2+2ab+b^2\\) to find \\(a^2+b^2\\).",
      "difficulty": "Medium",
      "cognitiveLevel": "Application",
      "question": "If \\(a+b=10\\) and \\(ab=21\\), find \\(a^2+b^2\\).",
      "options": [
        {
          "label": "A",
          "text": "\\(79\\)"
        },
        {
          "label": "B",
          "text": "\\(58\\)"
        }
      ],
      "answer": "B",
      "explanation": "Using\n\\[\n(a+b)^2=a^2+2ab+b^2,\n\\]\nwe rearrange to get\n\\[\na^2+b^2=(a+b)^2-2ab.\n\\]\nSubstitute \\(a+b=10\\) and \\(ab=21\\):\n\\[\na^2+b^2=10^2-2\\cdot 21=100-42=58.\n\\]\nTherefore, \\(a^2+b^2=58\\). Option A incorrectly subtracts \\(ab\\) only once.",
      "hint": "Use \\((a+b)^2=a^2+2ab+b^2\\) and solve for \\(a^2+b^2\\)."
    },
    {
      "id": "math-gaokao-32-q006",
      "category": "Algebra",
      "concept": "Perfect-Square Identities",
      "learningObjective": "Use the square of a binomial to find \\(x^2+\\frac{1}{x^2}\\).",
      "difficulty": "Medium",
      "cognitiveLevel": "Application",
      "question": "If \\(x+\\frac{1}{x}=5\\), find \\(x^2+\\frac{1}{x^2}\\).",
      "options": [
        {
          "label": "A",
          "text": "\\(23\\)"
        },
        {
          "label": "B",
          "text": "\\(25\\)"
        }
      ],
      "answer": "A",
      "explanation": "Square both sides of \\(x+\\frac{1}{x}=5\\):\n\\[\n\\left(x+\\frac{1}{x}\\right)^2=25.\n\\]\nUsing \\((a+b)^2=a^2+2ab+b^2\\),\n\\[\nx^2+2\\cdot x\\cdot \\frac{1}{x}+\\frac{1}{x^2}=25.\n\\]\nSince \\(x\\cdot \\frac{1}{x}=1\\),\n\\[\nx^2+2+\\frac{1}{x^2}=25.\n\\]\nTherefore,\n\\[\nx^2+\\frac{1}{x^2}=25-2=23.\n\\]\nOption B is the square of \\(5\\) without subtracting \\(2\\).",
      "hint": "Square \\(x+\\frac{1}{x}\\) and remember that \\(x\\cdot \\frac{1}{x}=1\\)."
    },
    {
      "id": "math-gaokao-32-q007",
      "category": "Algebra",
      "concept": "Completing the Square",
      "learningObjective": "Determine the constant needed to complete a perfect-square trinomial.",
      "difficulty": "Medium",
      "cognitiveLevel": "Application",
      "question": "What constant must be added to \\(x^2+8x\\) to make it a perfect-square trinomial?",
      "options": [
        {
          "label": "A",
          "text": "\\(64\\)"
        },
        {
          "label": "B",
          "text": "\\(16\\)"
        }
      ],
      "answer": "B",
      "explanation": "A perfect-square trinomial has the form\n\\[\nx^2+2bx+b^2=(x+b)^2.\n\\]\nHere \\(2b=8\\), so \\(b=4\\). Therefore, the constant is\n\\[\nb^2=4^2=16.\n\\]\nIndeed,\n\\[\nx^2+8x+16=(x+4)^2.\n\\]\nOption A uses \\(8^2=64\\), which is incorrect.",
      "hint": "Find half of the coefficient of \\(x\\), then square it."
    },
    {
      "id": "math-gaokao-32-q008",
      "category": "Algebra",
      "concept": "Perfect-Square Identities",
      "learningObjective": "Use the identity \\((a+b)^2=a^2+2ab+b^2\\) to compute \\((a+b)^2\\).",
      "difficulty": "Medium",
      "cognitiveLevel": "Reasoning",
      "question": "If \\(a^2+b^2=25\\) and \\(ab=12\\), find \\((a+b)^2\\).",
      "options": [
        {
          "label": "A",
          "text": "\\(1\\)"
        },
        {
          "label": "B",
          "text": "\\(49\\)"
        }
      ],
      "answer": "B",
      "explanation": "Using\n\\[\n(a+b)^2=a^2+2ab+b^2,\n\\]\nsubstitute \\(a^2+b^2=25\\) and \\(ab=12\\):\n\\[\n(a+b)^2=25+2\\cdot 12=25+24=49.\n\\]\nTherefore, \\((a+b)^2=49\\). Option A corresponds to \\((a-b)^2=25-24=1\\), not \\((a+b)^2\\).",
      "hint": "Use \\((a+b)^2=a^2+b^2+2ab\\)."
    },
    {
      "id": "math-gaokao-32-q009",
      "category": "Algebra",
      "concept": "Difference of Perfect Squares",
      "learningObjective": "Simplify a difference of two squared binomials.",
      "difficulty": "Hard",
      "cognitiveLevel": "Analysis",
      "question": "Simplify \\((x+y)^2-(x-y)^2\\).",
      "options": [
        {
          "label": "A",
          "text": "\\(4xy\\)"
        },
        {
          "label": "B",
          "text": "\\(2xy\\)"
        }
      ],
      "answer": "A",
      "explanation": "Expand each square:\n\\[\n(x+y)^2=x^2+2xy+y^2,\n\\]\nand\n\\[\n(x-y)^2=x^2-2xy+y^2.\n\\]\nSubtract:\n\\[\n(x+y)^2-(x-y)^2=(x^2+2xy+y^2)-(x^2-2xy+y^2).\n\\]\nSimplifying,\n\\[\nx^2+2xy+y^2-x^2+2xy-y^2=4xy.\n\\]\nTherefore, the simplified expression is \\(4xy\\).",
      "hint": "Expand both perfect squares, then subtract carefully."
    },
    {
      "id": "math-gaokao-32-q010",
      "category": "Algebra",
      "concept": "Perfect-Square Identities",
      "learningObjective": "Use \\((x+y)^2=x^2+y^2+2xy\\) to find \\(xy\\).",
      "difficulty": "Hard",
      "cognitiveLevel": "Problem-Solving",
      "question": "If \\(x^2+y^2=13\\) and \\(x+y=5\\), find \\(xy\\).",
      "options": [
        {
          "label": "A",
          "text": "\\(6\\)"
        },
        {
          "label": "B",
          "text": "\\(12\\)"
        }
      ],
      "answer": "A",
      "explanation": "Using\n\\[\n(x+y)^2=x^2+y^2+2xy,\n\\]\nsubstitute \\(x+y=5\\) and \\(x^2+y^2=13\\):\n\\[\n5^2=13+2xy.\n\\]\nThus,\n\\[\n25=13+2xy.\n\\]\nSubtract \\(13\\):\n\\[\n12=2xy.\n\\]\nDivide by \\(2\\):\n\\[\nxy=6.\n\\]\nTherefore, \\(xy=6\\). Option B is the value of \\(2xy\\), not \\(xy\\).",
      "hint": "Use \\((x+y)^2=x^2+y^2+2xy\\) and substitute the given values."
    }
  ]
}