{
  "schemaVersion": "1.0",
  "type": "mcq",
  "id": "math-gaokao-149",
  "category": "— CHALLENGE HIGHER. GO FURTHER. —",
  "title": "MATH GAOKAO - 149",
  "description": "Authentic-style mathematics problems inspired by China’s Gaokao — build deeper understanding, sharper thinking, and real exam readiness.",
  "questionCount": 10,
  "questions": [
    {
      "id": "math-gaokao-149-q001",
      "category": "Trigonometry",
      "concept": "Amplitude of a Sine Function",
      "learningObjective": "Determine the amplitude of a sine function from its equation.",
      "difficulty": "Easy",
      "cognitiveLevel": "Comprehension",
      "question": "Find the amplitude of the function\n\\[\ny=3\\sin x.\n\\]",
      "options": [
        {
          "label": "A",
          "text": "\\(3\\)"
        },
        {
          "label": "B",
          "text": "\\(\\frac{1}{3}\\)"
        }
      ],
      "answer": "A",
      "explanation": "For a function written as\n\\[\ny=A\\sin x,\n\\]\nthe amplitude is\n\\[\n|A|.\n\\]\nHere \\(A=3\\), so the amplitude is\n\\[\n|3|=3.\n\\]\nTherefore, the amplitude is \\(3\\).",
      "hint": "Compare the equation with \\(y=A\\sin x\\) and take the absolute value of \\(A\\)."
    },
    {
      "id": "math-gaokao-149-q002",
      "category": "Trigonometry",
      "concept": "Period of a Sine Function",
      "learningObjective": "Determine the period of a sine function with a horizontal compression.",
      "difficulty": "Easy",
      "cognitiveLevel": "Procedural",
      "question": "Find the period of the function\n\\[\ny=\\sin(2x).\n\\]",
      "options": [
        {
          "label": "A",
          "text": "\\(2\\pi\\)"
        },
        {
          "label": "B",
          "text": "\\(\\pi\\)"
        }
      ],
      "answer": "B",
      "explanation": "For a function written as\n\\[\ny=\\sin(Bx),\n\\]\nthe period is\n\\[\n\\frac{2\\pi}{|B|}.\n\\]\nHere \\(B=2\\), so the period is\n\\[\n\\frac{2\\pi}{2}=\\pi.\n\\]\nTherefore, the period is \\(\\pi\\).",
      "hint": "Use the formula \\(\\frac{2\\pi}{|B|}\\) for \\(y=\\sin(Bx)\\)."
    },
    {
      "id": "math-gaokao-149-q003",
      "category": "Trigonometry",
      "concept": "Phase Shift of a Sine Function",
      "learningObjective": "Determine the phase shift of a sine function from its equation.",
      "difficulty": "Easy",
      "cognitiveLevel": "Comprehension",
      "question": "Find the phase shift of the graph of\n\\[\ny=\\sin\\left(x-\\frac{\\pi}{4}\\right).\n\\]",
      "options": [
        {
          "label": "A",
          "text": "\\(\\frac{\\pi}{4}\\) to the right"
        },
        {
          "label": "B",
          "text": "\\(\\frac{\\pi}{4}\\) to the left"
        }
      ],
      "answer": "A",
      "explanation": "For a function written as\n\\[\ny=\\sin(x-C),\n\\]\nthe phase shift is \\(C\\) units to the right. Here\n\\[\nC=\\frac{\\pi}{4},\n\\]\nso the phase shift is\n\\[\n\\frac{\\pi}{4}\\text{ to the right}.\n\\]",
      "hint": "Identify \\(C\\) in \\(y=\\sin(x-C)\\)."
    },
    {
      "id": "math-gaokao-149-q004",
      "category": "Trigonometry",
      "concept": "Amplitude of a Cosine Function",
      "learningObjective": "Determine the amplitude of a cosine function with a negative coefficient.",
      "difficulty": "Easy",
      "cognitiveLevel": "Comprehension",
      "question": "Find the amplitude of the function\n\\[\ny=-2\\cos x.\n\\]",
      "options": [
        {
          "label": "A",
          "text": "\\(2\\)"
        },
        {
          "label": "B",
          "text": "\\(-2\\)"
        }
      ],
      "answer": "A",
      "explanation": "For a function written as\n\\[\ny=A\\cos x,\n\\]\nthe amplitude is\n\\[\n|A|.\n\\]\nHere \\(A=-2\\), so the amplitude is\n\\[\n|-2|=2.\n\\]\nTherefore, the amplitude is \\(2\\).",
      "hint": "Amplitude is always nonnegative and equals the absolute value of the coefficient."
    },
    {
      "id": "math-gaokao-149-q005",
      "category": "Trigonometry",
      "concept": "Period of a Cosine Function",
      "learningObjective": "Determine the period of a cosine function with a horizontal compression.",
      "difficulty": "Medium",
      "cognitiveLevel": "Procedural",
      "question": "Find the period of the function\n\\[\ny=\\cos(3x).\n\\]",
      "options": [
        {
          "label": "A",
          "text": "\\(3\\pi\\)"
        },
        {
          "label": "B",
          "text": "\\(\\frac{2\\pi}{3}\\)"
        }
      ],
      "answer": "B",
      "explanation": "For a function written as\n\\[\ny=\\cos(Bx),\n\\]\nthe period is\n\\[\n\\frac{2\\pi}{|B|}.\n\\]\nHere \\(B=3\\), so the period is\n\\[\n\\frac{2\\pi}{3}.\n\\]\nTherefore, the period is \\(\\frac{2\\pi}{3}\\).",
      "hint": "Use the formula \\(\\frac{2\\pi}{|B|}\\) for \\(y=\\cos(Bx)\\)."
    },
    {
      "id": "math-gaokao-149-q006",
      "category": "Trigonometry",
      "concept": "Phase Shift of a Cosine Function",
      "learningObjective": "Determine the phase shift of a cosine function from its equation.",
      "difficulty": "Medium",
      "cognitiveLevel": "Application",
      "question": "Find the phase shift of the graph of\n\\[\ny=\\cos\\left(x+\\frac{\\pi}{3}\\right).\n\\]",
      "options": [
        {
          "label": "A",
          "text": "\\(\\frac{\\pi}{3}\\) to the left"
        },
        {
          "label": "B",
          "text": "\\(\\frac{\\pi}{3}\\) to the right"
        }
      ],
      "answer": "A",
      "explanation": "Rewrite the function as\n\\[\ny=\\cos\\left(x-\\left(-\\frac{\\pi}{3}\\right)\\right).\n\\]\nFor \\(y=\\cos(x-C)\\), the phase shift is \\(C\\) units to the right. Here\n\\[\nC=-\\frac{\\pi}{3},\n\\]\nso the phase shift is \\(\\frac{\\pi}{3}\\) to the left.",
      "hint": "Rewrite as \\(y=\\cos(x-C)\\) to identify the shift."
    },
    {
      "id": "math-gaokao-149-q007",
      "category": "Trigonometry",
      "concept": "Amplitude of a Transformed Sine Function",
      "learningObjective": "Determine the amplitude of a sine function with multiple transformations.",
      "difficulty": "Medium",
      "cognitiveLevel": "Application",
      "question": "Find the amplitude of the function\n\\[\ny=4\\sin\\left(2x-\\frac{\\pi}{2}\\right).\n\\]",
      "options": [
        {
          "label": "A",
          "text": "\\(4\\)"
        },
        {
          "label": "B",
          "text": "\\(2\\)"
        }
      ],
      "answer": "A",
      "explanation": "For a function written as\n\\[\ny=A\\sin(Bx-C),\n\\]\nthe amplitude is\n\\[\n|A|.\n\\]\nHere \\(A=4\\), so the amplitude is\n\\[\n|4|=4.\n\\]\nTherefore, the amplitude is \\(4\\).",
      "hint": "Look at the coefficient of the sine function."
    },
    {
      "id": "math-gaokao-149-q008",
      "category": "Trigonometry",
      "concept": "Period of a Tangent Function",
      "learningObjective": "Determine the period of a tangent function with a horizontal compression.",
      "difficulty": "Medium",
      "cognitiveLevel": "Procedural",
      "question": "Find the period of the function\n\\[\ny=\\tan(2x).\n\\]",
      "options": [
        {
          "label": "A",
          "text": "\\(2\\pi\\)"
        },
        {
          "label": "B",
          "text": "\\(\\frac{\\pi}{2}\\)"
        }
      ],
      "answer": "B",
      "explanation": "For a function written as\n\\[\ny=\\tan(Bx),\n\\]\nthe period is\n\\[\n\\frac{\\pi}{|B|}.\n\\]\nHere \\(B=2\\), so the period is\n\\[\n\\frac{\\pi}{2}.\n\\]\nTherefore, the period is \\(\\frac{\\pi}{2}\\).",
      "hint": "Use the formula \\(\\frac{\\pi}{|B|}\\) for \\(y=\\tan(Bx)\\)."
    },
    {
      "id": "math-gaokao-149-q009",
      "category": "Trigonometry",
      "concept": "Phase Shift of a Cosine Function with Horizontal Stretch",
      "learningObjective": "Determine the phase shift of a cosine function after factoring the coefficient of \\(x\\).",
      "difficulty": "Hard",
      "cognitiveLevel": "Analysis",
      "question": "Find the phase shift of the graph of\n\\[\ny=3\\cos(2x+\\pi).\n\\]",
      "options": [
        {
          "label": "A",
          "text": "\\(\\frac{\\pi}{4}\\) to the right"
        },
        {
          "label": "B",
          "text": "\\(\\frac{\\pi}{2}\\) to the left"
        }
      ],
      "answer": "B",
      "explanation": "Factor out \\(2\\) from the argument:\n\\[\ny=3\\cos\\left(2\\left(x+\\frac{\\pi}{2}\\right)\\right)\n=3\\cos\\left(2\\left(x-\\left(-\\frac{\\pi}{2}\\right)\\right)\\right).\n\\]\nFor a function written as\n\\[\ny=A\\cos(B(x-C)),\n\\]\nthe phase shift is \\(C\\) units to the right. Here\n\\[\nC=-\\frac{\\pi}{2},\n\\]\nso the phase shift is \\(\\frac{\\pi}{2}\\) to the left. Shifting right by \\(\\frac{\\pi}{4}\\) would produce \\(3\\cos(2x-\\frac{\\pi}{2})\\), not the given graph.",
      "hint": "Factor out the coefficient of \\(x\\) to identify the phase shift."
    },
    {
      "id": "math-gaokao-149-q010",
      "category": "Trigonometry",
      "concept": "Amplitude of a Sine Function with Negative Coefficient",
      "learningObjective": "Determine the amplitude of a sine function with a negative coefficient and horizontal compression.",
      "difficulty": "Easy",
      "cognitiveLevel": "Comprehension",
      "question": "Find the amplitude of the function\n\\[\ny=-5\\sin(3x).\n\\]",
      "options": [
        {
          "label": "A",
          "text": "\\(-5\\)"
        },
        {
          "label": "B",
          "text": "\\(5\\)"
        }
      ],
      "answer": "B",
      "explanation": "For a function written as\n\\[\ny=A\\sin(Bx),\n\\]\nthe amplitude is\n\\[\n|A|.\n\\]\nHere \\(A=-5\\), so the amplitude is\n\\[\n|-5|=5.\n\\]\nTherefore, the amplitude is \\(5\\).",
      "hint": "Amplitude is the absolute value of the coefficient of the sine function."
    }
  ]
}